学校ID,学校コード,学校所在地_都道府県名,学校所在地_郡名,学校所在地_市区町村名,学校所在地_行政区名,学校所在地_全国地方公共団体コード,学校名称,学校名称_カナ,行政サービス拠点種別,通学区域_登録年月日,通学区域_廃止日,通学区域の住所,特記事項,ポリゴン_ファイル名
2100001,,山口県,,岩国市,,352080,小瀬小学校,オゼショウガッコウ,1503,,,小瀬,,
2100002,,山口県,,岩国市,,352080,御庄小学校,ミショウショウガッコウ,1503,,,御庄;大谷;持国;御庄一丁目から五丁目まで,,
2100003,,山口県,,岩国市,,352080,藤河小学校,フジカワショウガッコウ,1503,,,関戸;多田（横山側を除く。）;田原;阿品、沼田ケ原地区;関戸一丁目;多田一丁目から三丁目まで,,
2100004,,山口県,,岩国市,,352080,杭名小学校,クイナショウガッコウ,1503,,,守内;瓦谷;杭名;下;行波;天尾のうち荒瀬地区（天尾小が休校している間は、天尾小の通学区域を含む。）,,
2100005,,山口県,,岩国市,,352080,天尾小学校（休校）,テンノウショウガッコウ,1503,,,天尾（荒瀬地区を除く。）;二鹿;相ノ谷,,
2100006,,山口県,,岩国市,,352080,河内小学校,コウチショウガッコウ,1503,,,廿木;竹安;伊房;大山;保木;角;寺山;土生;上田;行正;近延;入野,,
2100007,,山口県,,岩国市,,352080,柱野小学校,ハシラノショウガッコウ,1503,,,柱野;六呂師;叶木,,
2100008,,山口県,,岩国市,,352080,通津小学校,ツヅショウガッコウ,1503,,,通津;長野;保津町二丁目8番、9番、11番、12番、13番38号、19番46号、47号、48号、50号、52号及び53号、21番並びに23番,,
2100009,,山口県,,岩国市,,352080,岩国小学校,イワクニショウガッコウ,1503,,,錦見;岩国;横山;川西;牛野谷町（三丁目を除く。）;多田のうち横山側,,
2100010,,山口県,,岩国市,,352080,麻里布小学校,マリフショウガッコウ,1503,,,麻里布町（一丁目8番95号及び97号並びに二丁目10番を除く。）;室の木町;今津町;立石町（一丁目を除く。）;砂山町;山手町,,
2100011,,山口県,,岩国市,,352080,装港小学校（休校）,ショウコウショウガッコウ,1503,,,装束町;新港町,,
2100012,,山口県,,岩国市,,352080,柱島小学校（休校）,ハシラジマショウガッコウ,1503,,,柱島のうち柱島地区,,
2100013,,山口県,,岩国市,,352080,黒島小学校（休校）,クロシマショウガッコウ,1503,,,柱島のうち黒島地区,,
2100014,,山口県,,岩国市,,352080,端島小学校（休校）,ハシマショウガッコウ,1503,,,柱島のうち端島地区,,
2100015,,山口県,,岩国市,,352080,川下小学校,カワシモショウガッコウ,1503,,,楠町;中津町;車町;川下町;旭町;三角町,,
2100016,,山口県,,岩国市,,352080,愛宕小学校,アタゴショウガッコウ,1503,,,牛野谷町三丁目;門前町;尾津町;愛宕町;南岩国町一丁目（20番、21番、23番から30番までを除く。）;南岩国町二丁目（1番から8番まで、9番の一部、47番から112番までを除く。）,,
2100017,,山口県,,岩国市,,352080,灘小学校,ナダショウガッコウ,1503,,,灘町;南岩国町（一丁目、二丁目、三丁目28番の一部、29番から38番まで、四丁目1番から54番まで、80番から90番までを除く。）;海土路町（一丁目1番から5番までを除く。）;藤生町;黒磯町一丁目1番、2番;黒磯町二丁目1番から4番まで,,
2100018,,山口県,,岩国市,,352080,中洋小学校,チュウヨウショウガッコウ,1503,,,黒磯町（一丁目1番及び2番並びに二丁目1番から4番までを除く。）;青木町;保津町（二丁目8番、9番、11番、12番、13番38号、19番46号、47号、48号、50号、52号及び53号、21番並びに23番を除く。）,,
2100019,,山口県,,岩国市,,352080,平田小学校,ヒラタショウガッコウ,1503,,,平田;南岩国町一丁目20番、21番、23番から30番まで;南岩国町二丁目1番から8番まで、9番の一部、47番から112番まで;南岩国町三丁目28番の一部、29番から38番まで;南岩国町四丁目1番から54番まで、80番から90番まで;海土路町一丁目1番から5番まで,,
2100020,,山口県,,岩国市,,352080,東小学校,ヒガシショウガッコウ,1503,,,日の出町;川口町;三笠町;桂町;元町;昭和町;飯田町;麻里布町一丁目8番95号及び97号;麻里布町二丁目10番;立石町一丁目（装港小が休校している間は、装港小の通学区域を含む。）,,
2100021,,山口県,,岩国市,,352080,由宇小学校,ユウショウガッコウ,1503,,,由宇町千鳥ヶ丘一丁目;由宇町千鳥ヶ丘二丁目;由宇町千鳥ヶ丘三丁目;由宇町中央一丁目;由宇町中央二丁目;由宇町港一丁目;由宇町港二丁目;由宇町港三丁目;由宇町南沖一丁目;由宇町南沖二丁目;由宇町南沖三丁目;由宇町南沖四丁目;由宇町南一丁目;由宇町南二丁目;由宇町南三丁目;由宇町南四丁目;由宇町南五丁目;由宇町西一丁目;由宇町西二丁目;由宇町西三丁目;由宇町北一丁目;由宇町北二丁目;由宇町北三丁目;由宇町北四丁目;由宇町北五丁目;由宇町北六丁目;由宇町北七丁目及び由宇崎;由宇町のうち清水、中村、正南、上北、有家地区,,
2100022,,山口県,,岩国市,,352080,由西小学校,ユセイショウガッコウ,1503,,,由宇町のうち西区、笠塚、峇清、横道、中倉、小槇、寺迫地区,,
2100023,,山口県,,岩国市,,352080,神東小学校,シントウショウガッコウ,1503,,,由宇町のうち神東、天神、大畑、原、舟木、公門所地区,,
2100024,,山口県,,岩国市,,352080,玖珂小学校,クガショウガッコウ,1503,,,玖珂町,,
2100025,,山口県,,岩国市,,352080,本郷小学校,ホンゴウショウガッコウ,1503,,,本郷町本郷;本郷町宇塚;本郷町西黒沢及び本谷（波野小が休校している間は、波野小の通学区域を含む。）,,
2100026,,山口県,,岩国市,,352080,波野小学校（休校）,ハノショウガッコウ,1503,,,本郷町波野,,
2100027,,山口県,,岩国市,,352080,そお小学校,ソオショウガッコウ,1503,,,周東町祖生,,
2100028,,山口県,,岩国市,,352080,高森小学校,タカモリショウガッコウ,1503,,,周東町上久原のうち東午王ノ内、西午王ノ内、久田北、久田東、久田西、神幡、栄町、朝日、高南、東町、上久宗、中久宗、下久宗、河田地区;周東町下久原のうち千束、上市上、上市中、上市下、大柿、泉町、道仏、中市、下市、緑町、小森、北方、小川、宇谷、南方地区;周東町用田（中田小が休校している間は、中田小の通学区域を含む。）,,
2100029,,山口県,,岩国市,,352080,中田小学校（休校）,ナカタショウガッコウ,1503,,,周東町田尻のうち奥畑、田尻地区;周東町中山のうち第一中山、第二中山地区,,
2100030,,山口県,,岩国市,,352080,川上小学校,カワカミショウガッコウ,1503,,,周東町下久原のうち下川上地区;周東町川上のうち上川上、小畑の地区;周東町中山のうち明見谷,,
2100031,,山口県,,岩国市,,352080,米川小学校,ヨネガワショウガッコウ,1503,,,周東町差川のうち上中曽根、下中曽根、下差川、上差川、井掘地区;周東町西長野のうち上相津、下相津、東中村、中中村、西中村、末法地区,,
2100032,,山口県,,岩国市,,352080,修成小学校,シュウセイショウガッコウ,1503,,,周東町下須通のうち須通地区、周東町西長野のうち鳴川、中島、下長野、中長野、東長野、上長野地区;周東町上須通のうち梅の木、中上椎、石ケ明神地区;周東町差川のうち中差川地区（周北小が休校している間は、周北小の通学区域を含む。）,,
2100033,,山口県,,岩国市,,352080,周北小学校（休校）,シュウホクショウガッコウ,1503,,,周東町獺越のうち田代、明神、北畑、久杉、郷上、郷下、毛明、桧余地、高后岩地区;周東町三瀬川のうち東、長尾、東郷、西郷、松尾、地吉地区;周東町樋余地,,
2100034,,山口県,,岩国市,,352080,錦清流小学校,ニシキセイリュウショウガッコウ,1503,,,錦町広瀬;錦町野谷;錦町府谷;錦町中ノ瀬;錦町大野;錦町深川及び須川（美川小が休校している間は、美川小の通学区域を含む。）,,
2100035,,山口県,,岩国市,,352080,宇佐川小学校,ウサガワショウガッコウ,1503,,,錦町宇佐郷;錦町大原及び宇佐,,
2100036,,山口県,,岩国市,,352080,美川小学校（休校）,ミカワショウガッコウ,1503,,,美川町南桑;美川町根笠;美川町四馬神;美川町小川及び添谷,,
2100038,,山口県,,岩国市,,352080,美和小学校,ミワショウガッコウ,1503,,,美和町,,
2100039,,山口県,,岩国市,,352080,御庄中学校（休校）,ミショウチュウガッコウ,1504,,,御庄;大谷;持国;御庄一丁目から五丁目まで,,
2100040,,山口県,,岩国市,,352080,岩国西中学校,イワクニニシチュウガッコウ,1504,,,守内;瓦谷;杭名;下;行波;天尾のうち荒瀬地区;天尾（荒瀬地区を除く。）;二鹿;相ノ谷;廿木;竹安;伊房;大山;保木;角;寺山;土生;上田;行正;近延;入野,,
2100041,,山口県,,岩国市,,352080,通津中学校,ツヅチュウガッコウ,1504,,,通津;長野;保津町二丁目8番、9番、11番、12番、13番38号、19番46号、47号、48号、50号、52号及び53号、21番並びに23番,,
2100042,,山口県,,岩国市,,352080,岩国中学校,イワクニチュウガッコウ,1504,,,錦見;岩国;横山;川西;牛野谷町（三丁目を除く。）;多田のうち横山側;関戸;多田（横山側を除く。）;田原;阿品;小瀬のうち丸田、持ケ峠、沼田ケ原地区;関戸一丁目;多田一丁目から三丁目まで;柱野;六呂師;叶木（御庄中が休校している間は、御庄中の通学区域を含む。）,,
2100043,,山口県,,岩国市,,352080,平田中学校,ヒラタチュウガッコウ,1504,,,平田;南岩国町一丁目20番、21番、23番から30番まで;南岩国町二丁目1番から8番まで、9番の一部、47番から112番まで;南岩国町三丁目28番の一部、29番から38番まで;南岩国町四丁目1番から54番まで、80番から90番まで;海土路町一丁目1番から5番まで,,
2100044,,山口県,,岩国市,,352080,麻里布中学校,マリフチュウガッコウ,1504,,,麻里布町（一丁目8番95号及び97号並びに二丁目10番を除く。）;室の木町;今津町;立石町（一丁目を除く。）;砂山町;山手町,,
2100045,,山口県,,岩国市,,352080,川下中学校,カワシモチュウガッコウ,1504,,,楠町;中津町;車町;川下町;旭町;三角町;牛野谷町三丁目;門前町;尾津町;愛宕町;南岩国町一丁目（20番、21番、23番から30番までを除く。）;南岩国町二丁目（1番から8番まで、9番の一部、47番から112番までを除く。）,,
2100046,,山口県,,岩国市,,352080,灘中学校,ナダチュウガッコウ,1504,,,灘町;南岩国町（一丁目、二丁目、三丁目28番の一部、29番から38番まで、四丁目1番から54番まで、80番から90番までを除く。）;海土路町（一丁目1番から5番までを除く。）;藤生町;黒磯町一丁目1番、2番;黒磯町二丁目1番から4番まで;黒磯町（一丁目1番及び2番並びに二丁目1番から4番までを除く。）;青木町;保津町（二丁目8番、9番、11番、12番、13番38号、19番46号、47号、48号、50号、52号及び53号、21番並びに23番を除く。）,,
2100047,,山口県,,岩国市,,352080,東中学校,ヒガシチュウガッコウ,1504,,,日の出町;川口町;三笠町;桂町;元町;昭和町;飯田町;麻里布町一丁目8番95号及び97号;麻里布町二丁目10番;立石町一丁目;装束町;新港町;小瀬,,
2100048,,山口県,,岩国市,,352080,柱島中学校（休校）,ハシラジマチュウガッコウ,1504,,,柱島のうち柱島地区,,
2100049,,山口県,,岩国市,,352080,黒島中学校（休校）,クロシマチュウガッコウ,1504,,,柱島のうち黒島地区,,
2100050,,山口県,,岩国市,,352080,端島中学校（休校）,ハシマチュウガッコウ,1504,,,柱島のうち端島地区,,
2100051,,山口県,,岩国市,,352080,由宇中学校,ユウチュウガッコウ,1504,,,由宇町,,
2100052,,山口県,,岩国市,,352080,玖珂中学校,クガチュウガッコウ,1504,,,玖珂町,,
2100053,,山口県,,岩国市,,352080,本郷中学校,ホンゴウチュウガッコウ,1504,,,本郷町,,
2100054,,山口県,,岩国市,,352080,周東中学校,シュウトウチュウガッコウ,1504,,,周東町,,
2100055,,山口県,,岩国市,,352080,錦中学校,ニシキチュウガッコウ,1504,,,錦町（美川中が休校している間は、美川中の通学区域を含む。）,,
2100056,,山口県,,岩国市,,352080,美川中学校（休校）,ミカワチュウガッコウ,1504,,,美川町,,
2100057,,山口県,,岩国市,,352080,美和中学校,ミワチュウガッコウ,1504,,,美和町,,
