352080,1100044,山口県岩国市,認定こども園 藤生幼稚園,ニンテイコドモエン フジュウヨウチエン,,認定こども園（幼稚園型）,352080,,山口県岩国市藤生町1-3-18,山口県,岩国市藤生町1-3-18,,,,34.1155438,132.1986463,,,JR藤生駅から徒歩5分、いわくにバス 丸子バス停から徒歩2分,駐車スペース40台,0827-32-1811,,0827-32-7743,,,,,4250005006039 ,学校法人藤生学園,2017/4/1,44,１歳から,月火水木金土,7:30:00,18:00:00,第2土曜・日曜・祝休日はお休み。盆・年末年始はお休み,有,,,,,,,,,,,,http://www.fujuyouchien.com/,,,
352080,1100045,山口県岩国市,認定こども園　光顔幼稚園,ニンテイコドモエン　コウゲンヨウチエン,,認定こども園（幼稚園型）,352080,,山口県岩国市御庄1691,山口県,岩国市御庄1691,,,,34.1656559,132.1444937,,,新岩国駅から車で5分、御庄小学校から車で3分,駐車スペース50台,0827-46-0024,,0827-46-1524,,,,,7250005006028 ,学校法人大津学園,1995/3/16,35,10ヶ月から,月火水木金土,7:00:00,18:00:00,日曜・祝休日はお休み。12月29日〜1月3日はお休み,無,,,,,,,,,,,,https://kougen-youchien.jimdo.com/,,,
352080,1100046,山口県岩国市,法寿幼稚園,ホウジュヨウチエン,,私立幼稚園,352080,,山口県岩国市車町1-9?22,山口県,岩国市車町1-9?22,,,,34.1578058,132.2184,,,いわくにバス　空港前バス停から徒歩3分,駐車スペース15台,0827-21-3881,,0827-21-3884,,,,,2250005006040 ,学校法人松谷学園,1981/3/9,25,３歳から,月火水木金,8:00:00,17:00:00,土曜・日曜・祝休日はお休み。夏休み・冬休み・春休みあり。,無,,,,,,,,,,,,http://www.houju-youchien.com/,,,
352080,1100047,山口県岩国市,岩国聖母幼稚園,イワクニセイボヨウチエン,,私立幼稚園,352080,,山口県岩国市砂山町2-9-19,山口県,岩国市砂山町2-9-19,,,,34.1750542,132.2154878,,,JR岩国駅から徒歩15分、いわくにバス(錦帯橋方面)砂山バス停から徒歩5分,駐車スペース25台,0827-22-9743,,0827-22-9744,,,,,6250005000477 ,学校法人信望愛学園,1957/1/31,60,3歳から,月火水木金,8:00:00,17:30:00,土曜・日曜・祝休日はお休み。夏休み・冬休み・春休みあり。,無,,,,,,,,,,,,http://iwakuniseibo.shinboai.ed.jp,,,
352080,1100048,山口県岩国市,北河内認定こども園,キタゴウチニンテイコドモエン,,認定こども園（幼稚園型）,352080,,山口県岩国市下454-26,山口県,岩国市下454-26,,,,34.1625948,132.0925502,,,錦川清流鉄道 行波駅から徒歩10分,駐車スペース20台,0827-47-2411,,0827-47-2411,,,,,4250005006030 ,学校法人三宝学園,2018/4/1,55,6ヶ月から,月火水木金土,7:00:00,18:00:00,日曜・祝休日はお休み。9:15〜園庭開放を実施(要電話確認)。,有,,,,,,,,,,,,https://kitagouchi-kodomoen.com/,,,
352080,1100049,山口県岩国市,岩国むつみ幼稚園,イワクニムツミヨウチエン,,私立幼稚園,352080,,山口県岩国市通津棒田ヶ迫2104-4,山口県,岩国市通津棒田ヶ迫2104-4,,,,34.0735509,132.181962,,,JR通津駅から徒歩15分、いわくにバス 浪の浦バス停から徒歩5分,駐車スペース5台・行事の時は園庭駐車可能,0827-38-1288,,0827-38-2350,,,,,9250005006034 ,学校法人通津学園,1974/4/1,60,3歳から,月火水木金,7:30:00,18:30:00,土曜・日曜・祝休日はお休み。12月29日〜1月3日はお休み。8月13日〜8月15日はお休み。園の定める日はお休み。,無,,,,,,,,,,,,http://mutsumi.jellybean.jp/,,,
352080,1100050,山口県岩国市,認定こども園 藤河幼稚園,ニンテイコドモエン　フジカワヨウチエン,,認定こども園（幼稚園型）,352080,,山口県岩国市多田1257-1,山口県,岩国市多田1257-1,,,,34.1829752,132.1653156,,,いわくにバス 下多田バス停から徒歩8分,駐車スペース12台・行事の時は臨時の駐車スペース20台,0827-41-1873,,0827-41-1870,,,,,6250005006037 ,学校法人藤河幼稚園,1968/4/1,73,8ヶ月から,月火水木金土,7:30:00,18:00:00,日曜・祝休日はお休み。12月29日〜1月3日はお休み,有,,,,,,,,,,,,http://www.fujikawayouchien.jp,,,
352080,1100051,山口県岩国市,認定こども園　岩国染香幼稚園,ニンテイコドモエン　イワクニセンコウヨウチエン,,認定こども園（幼稚園型）,352080,,山口県岩国市岩国2-6-32,山口県,岩国市岩国2-6-32,,,,34.1637951,132.1802361,,,JR川西駅から徒歩20分、いわくにバス 臥竜橋バス停すぐ,駐車スペース5台,0827-41-0534,,0827-43-2359,,,,,1250005006033 ,学校法人染香学園,1979/3/6,45,8ヶ月から,月火水木金土,7:30:00,18:30:00,日曜・祝休日はお休み。お盆・年末年始はお休み。,有,,,,,,,,,,,,https://ja-jp.facebook.com/senkouyouchien/,,,
352080,1100053,山口県岩国市,周東幼稚園,シュウトウヨウチエン,,私立幼稚園,352080,,山口県岩国市周東町下久原1152-20,山口県,岩国市周東町下久原1152-20,,,,34.0901517,132.0537288,,,JR周防高森駅から徒歩10分、防長交通 高森バス停から徒歩10分,駐車スペース15台,0827-84-2882,,0827-84-0501,,,,,8250005006332 ,学校法人周東学園,1977/9/26,35,３歳から,月火水木金,8:00:00,17:00:00,土曜・日曜・祝休日はお休み。夏休み・冬休み・春休みあり,無,,,,,,,,,,,,,,,
352080,1100054,山口県岩国市,認定こども園 岩国南幼稚園,ニンテイコドモエンイワクニミナミヨウチエン,,認定こども園（幼稚園型）,352080,,山口県岩国市平田6-28-3,山口県,岩国市平田6-28-3,,,,34.1375461,132.1885767,,,JR南岩国駅から徒歩15分,駐車スペース100台,0827-31-8009,,0827-32-1917,,,,,5250005006038 ,学校法人藤谷学園,2019/4/1,270,11か月から,月火水木金土,8:00:00,18:30:00,日曜・祝休日はお休み。年末年始はお休み。,無,,,,,,,,,,,,http://www.i-minami-youchien.net/,,,
