全国地方公共団体コード,法人番号,ID,地方公共団体名,名称,名称_カナ,名称_英語,所在地_全国地方公共団体コード,町字ID,所在地_連結表記,所在地_都道府県,所在地_市区町村,所在地_町字,所在地_番地以下,建物名等(方書),緯度,経度,設置者,電話番号,内線番号,連絡先メールアドレス,連絡先FormURL,連絡先備考（その他、SNSなど）,郵便番号,SSID,提供エリア,URL,備考
352110,5000020352110,352110000001,山口県長門市,長門市中央公民館,ナガトシチユウオウコウミンカン,central  community center  of Nagato city,352110,,山口県長門市東深川1326-6,山口県,長門市,東深川,1326-6,長門市中央公民館,34.3715435,131.181278,長門市,(0837)23-1181,,chuo.kominkan@city.nagato.lg.jp,,,7594101,chuokominkan,玄関ホールホール、会議室2・3、大講堂ステージ,,来館者開館時間使用可能
352110,5000020352110,352110000002,山口県長門市,三隅公民館,ミスミコウミンカン,Misumi community center,352110,,山口県長門市三隅下518番地,山口県,長門市,三隅下,518番地,,34.36523,131.24721,長門市,(0837)43-0811,,misumi.kominkan@city.nagato.lg.jp,,,7593803,misumikouminkan,全館(多目的ホール除く),,開館時間8:30?22:00使用可能(年末年始除く)
352110,5000020352110,352110000003,山口県長門市,日置農村環境改善センター,ヘキノウソンカンキョウカイゼンセンター,,352110,,山口県長門市日置上５８８０番地１,山口県,長門市,日置上,5880番地1,,34.38357,131.10595,長門市,0837-37-2340,,h.kaizen@city.nagato.lg.jp,,,7594401,heki_kaizen,センター内,,センター開館時間常時使用可能
352110,5000020352110,352110000004,山口県長門市,ラポールゆや,ラポールユヤ,,352110,,山口県長門市油谷新別名10833番地,山口県,長門市,油谷,新別名10833番地,ラポールゆや内,34.369824,131.054992,長門市,（0837）33-0051,,raporu@city.nagato.lg.jp,,,7594503,bunkakaikan,ラポールゆや館内全域,https://www.city.nagato.yamaguchi.jp/soshiki/45/,館内に掲示しているパスワードを入力することにより利用可能
352110,5000020352110,352110000005,山口県長門市,長門市立図書館,ナガトシリツトショカン,NAGATO CITY LIBRARY,352110,0000361,山口県長門市仙崎441番地1,山口県,長門市,仙崎,441番地1,,34.376726,141.346814,長門市,(0837)26-5123,,library@lib-nagato.jp,,,7594106,nagatolibrary,"2階視聴覚室、
2階研修室",https://www.city.nagato.yamaguchi.jp/site/library/,"無線LANの利用を希望する者は、カウンターで利用カードを提示するか、申込書を記入しパスワードを受け取る。
持ち込み機器の音量はオフにして使用しなければならない。ただし、ヘッドホン又はイヤホン等を使用する場合は、この限りでない。
(長門市立図書館無線ＬＡＮ利用に関する要綱から)"
352110,5000020352110,352110000006,山口県長門市,長門市立図書館ゆや分館,ナガトシリツトショカンユヤブンカン,,352110,,山口県長門市油谷新別名10833番地,山口県,長門市,油谷,新別名10833番地,ラポールゆや内,34.369824,131.054992,長門市,（0837）33-0051,,library@lib-nagato.jp,,,7594503,yuyabunkan,"図書館内、
ロビーの一部",https://www.city.nagato.yamaguchi.jp/site/library/,"無線LANの利用を希望する者は、カウンターで利用カードを提示するか、申込書を記入しパスワードを受け取る。
持ち込み機器の音量はオフにして使用しなければならない。ただし、ヘッドホン又はイヤホン等を使用する場合は、この限りでない。
(長門市立図書館無線ＬＡＮ利用に関する要綱から)"
